{
  "$schema": "http://json-schema.org/draft-04/schema#",
  "title": "Statement (response)",
  "description": "A summary of account statement is received",
  "type": "object",
  "required": ["echo_req", "msg_type"],
  "properties": {
    "statement": {
      "title": "statement",
      "description": "Account statement.",
      "type": "object",
      "additionalProperties": false,
      "properties": {
        "count": {
          "description": "Number of transactions returned in this call",
          "type": "number"
        },
        "transactions": {
          "description": "Array of returned transactions",
          "type": "array",
          "items": {
            "type": "object",
            "additionalProperties": false,
            "properties": {
              "action_type": {
                "description": "It is the type of action.",
                "type": "string",
                "enum": ["buy", "sell", "deposit", "withdrawal", "adjustment"]
              },
              "amount": {
                "description": "It is the amount of transaction.",
                "type": "number",
                "examples": [-83.23]
              },
              "app_id": {
                "description": "ID of the application where this contract was purchased.",
                "type": ["null", "string"]
              },
              "balance_after": {
                "description": "It is the remaining balance.",
                "type": "number",
                "examples": [10150.13]
              },
              "contract_id": {
                "description": "It is the contract ID.",
                "type": ["integer", "null"],
                "examples": [4867502908]
              },
              "longcode": {
                "description": "The description of contract purchased if description is set to `1`.",
                "type": "string"
              },
              "payout": {
                "description": "Payout price",
                "type": ["null", "number"]
              },
              "purchase_time": {
                "description": "Time at which contract was purchased, present only for sell transaction",
                "type": "integer"
              },
              "reference_id": {
                "description": "Internal transaction identifier for the corresponding buy transaction ( set only for contract selling )",
                "type": ["integer", "null"]
              },
              "shortcode": {
                "description": "Compact description of the contract purchased if description is set to `1`.",
                "type": ["null", "string"]
              },
              "transaction_id": {
                "description": "It is the transaction ID. In statement every contract (buy or sell) and every payment has a unique ID.",
                "type": "integer",
                "examples": [10867502908]
              },
              "transaction_time": {
                "description": "It is the time of transaction.",
                "type": "integer",
                "examples": [1441175849]
              }
            }
          }
        }
      }
    },
    "echo_req": {
      "description": "Echo of the request made.",
      "type": "object"
    },
    "msg_type": {
      "description": "Action name of the request made.",
      "type": "string",
      "enum": ["statement"]
    },
    "req_id": {
      "description": "Optional field sent in request to map to response, present only when request contains `req_id`.",
      "type": "integer"
    }
  }
}
