{"echo_req":{"date_from":1789347035,"date_to":1789347054,"description":1,"limit":100,"offset":0,"req_id":1,"statement":1},"msg_type":"statement","req_id":1,"statement":{"count":3,"transactions":[{"action_type":"sell","amount":18.83,"app_id":"SYNTHETIC-APP","balance_after":9954.57,"contract_id":12859891379,"longcode":"Win payout if Volatility 50 Index is strictly higher than entry spot at 15 seconds after contract start time.","payout":18.83,"purchase_time":1789347036,"reference_id":24655144239,"shortcode":"CALL_R_50_18.83_1789347036_1789347051_S0P_0","transaction_id":24655172099,"transaction_time":1789347052},{"action_type":"buy","amount":-10,"app_id":"SYNTHETIC-APP","balance_after":9935.74,"contract_id":12859892839,"longcode":"Win payout if Volatility 50 Index is strictly lower than entry spot at 15 seconds after contract start time.","payout":18.83,"reference_id":null,"shortcode":"PUT_R_50_18.83_1789347038_1789347053_S0P_0","transaction_id":24655146519,"transaction_time":1789347038},{"action_type":"buy","amount":-10,"app_id":"SYNTHETIC-APP","balance_after":9945.74,"contract_id":12859891379,"longcode":"Win payout if Volatility 50 Index is strictly higher than entry spot at 15 seconds after contract start time.","payout":18.83,"reference_id":null,"shortcode":"CALL_R_50_18.83_1789347036_1789347051_S0P_0","transaction_id":24655144239,"transaction_time":1789347036}]}}
